{
  "subject_id": "FND-02",
  "subject_title": "Specification-Based Test Design and Behavioral Modeling",
  "theoretical_foundations": "Specification-based testing is black-box testing in which the principal test basis is the externally visible input/output behavior described by requirements, use cases, tables, contracts, or behavioral models. The tester does not need the implementation structure, but does need a sufficiently precise model of the input domain, environmental assumptions, observable outputs, and verdict rules. The central abstraction is a test model: a representation of the test item that makes selected behavioral characteristics measurable. A test-design technique then identifies coverage items in that model and derives concrete cases. This separation matters because a coverage percentage measures the model selected, not the completeness or correctness of the real system.\n\nEquivalence partitioning (EP) divides an input or output domain into classes whose members are expected to receive equivalent treatment under the specification. Derivation is: enumerate each relevant parameter and environmental condition; identify valid and invalid regions, type and format classes, semantic categories, and combinations constrained by the requirement; make classes disjoint and collectively complete for the stated domain; select at least one representative per class; and record the rationale, expected result, and requirement identifiers. The adequacy claim is conditional: if the equivalence hypothesis is true, one representative can expose a class-level fault. It fails when behavior changes inside a purported class, when a class boundary is omitted, or when several variables interact in a way that the single-variable partition did not express. Output partitions are useful where multiple outputs are allowed or where error categories have distinct contractual meaning.\n\nBoundary-value analysis (BVA) strengthens EP around predicates at which behavior changes. For each ordered range, length, count, date, version, or quota, identify the legal boundary and select values immediately below, at, and immediately above it; include minimum and maximum representable values, empty and singleton cases, and semantic boundaries such as a calendar rollover or a retry limit. For continuous quantities, define the measurement precision and tolerance before selecting values. For multiple boundaries, vary one boundary while holding other parameters at a documented base value, then add targeted multi-boundary cases only when the specification makes their interaction material. The oracle must say whether the value is accepted, rejected, rounded, clamped, or mapped to a particular error. BVA is not a proof that every nearby value is safe: an implementation can contain an interior discontinuity, overflow before validation, or a boundary different from the documented one.\n\nDecision-table testing models Boolean causes or conditions and their required effects or actions. Build the table by extracting conditions from each rule, normalizing their truth values, enumerating meaningful decision rules, using a dash only when a condition is genuinely irrelevant, deleting infeasible combinations with an explicit constraint rationale, and checking that rules are both disjoint and complete over the stated domain. A test normally covers one rule, with expected outputs and side effects attached to the rule. Cause-effect graphing is the graph form of the same logic: extract causes and effects from prose, connect them with AND, OR, NOT and constraint relations, derive feasible assignments, and render or normalize the result as a decision table. The graph is valuable when causal dependencies are distributed across paragraphs; the table is usually easier to review, trace, and execute. Adequacy can require every feasible rule, every effect, and selected negative or infeasible-condition checks, while preserving a record for intentionally untestable rules.\n\nClassification-tree methods organize partition testing hierarchically. First choose relevant aspects of the test object, make a disjoint and complete classification for each aspect, recursively refine a class when it still hides materially different behavior, and mark feasible selections in a combination table. A selected test is a path through the tree with one choice per required aspect plus explicit constraint handling. The tree makes omitted dimensions and redundant choices visible and supports a coverage ledger for classes, selected combinations, and exceptional values. The method is not self-validating: categories can be chosen ad hoc, classes can overlap, and a visually complete tree can still omit a domain rule. Classification trees are most useful when inputs have several semantic dimensions and stakeholders need a reviewable model rather than a flat list.\n\nUse-case and scenario testing represent externally meaningful interactions. A use case states actor, goal, preconditions, trigger, main success flow, alternate flows, exception flows, and postconditions; a scenario is one feasible path through those flows. Derive at least one normal path, one path for each business-significant alternative, each exception or refusal, and each boundary condition on a guard. The test oracle checks observable messages, state changes, persisted business results, and postconditions, not merely that the final screen appears. Scenario tests expose missing requirements and cross-component contract errors, but natural-language steps may be ambiguous, a happy-path suite may omit recovery, and the number of paths can grow rapidly. A scenario is therefore an evidence-bearing example of behavior, not a claim that all behavior has been tested.\n\nState-transition testing models a finite set of identifiable states, events or inputs, guards, transitions, actions, outputs, and initial or terminal conditions. Derivation is: define state observables and abstraction boundaries; enumerate states and legal and illegal transitions from the specification; attach guards, actions, and expected outputs; check reachability, determinism where required, and invariant preservation; generate paths from the initial state; and map each path to concrete stimuli and reset/setup requirements. Common coverage levels are all states, all valid transitions, all transition pairs, and bounded n-transition or round-trip paths. All-state coverage does not imply all-transition coverage; all-transition coverage does not exercise every sequence-dependent fault; and unreachable or infeasible transitions must be reported rather than silently counted as covered. Invalid transitions are first-class tests when the requirement defines rejection, no-op, error, or security behavior. If state is not directly observable, use externally observable proxies and document the abstraction; otherwise the verdict can confuse an unobserved model state with a passing implementation.\n\nCoverage criteria are adequacy criteria over model elements. Formally, let R be the set of feasible test requirements induced by a model and C the requirements exercised by a test suite; structural coverage is |C|/|R|, with the denominator and exclusions made explicit. For EP it can be class coverage; for BVA, boundary and side coverage; for decision tables and cause-effect graphs, rule/effect coverage; for classification trees, class and selected-choice coverage; for use cases, flow and exception-path coverage; and for state models, state, transition, transition-pair, or bounded-path coverage. Coverage is evidence of sampling discipline, not a probability of correctness. Adequacy also requires a valid test basis, a feasibility rationale, an oracle for each requirement, and traceability to the source requirement. A high score against an incomplete or contradictory model is false confidence.\n\nOracle construction should be designed with the model, not added after test selection. For each test, store preconditions, stimulus, expected output set or exact value, expected state/postcondition, permitted nondeterminism, timing or ordering assumptions that are in scope, and a verdict rule. Derive expected values from an independently reviewed requirement, a reference calculation, a decision-table rule, a state transition, or a business invariant; avoid copying the implementation's algorithm into the oracle. For nondeterministic behavior, assert membership in an allowed set or a relation among observations. For negative tests, assert both the rejection result and the absence of forbidden side effects. A two-person or independently implemented oracle is warranted for high-consequence rules.\n\nA worked engineering pattern is an account-recovery API. EP partitions the account identifier into registered, unregistered, malformed, and disabled classes. BVA targets token length at one below, exactly at, and one above its allowed range, plus expiry at just before, at, and just after the deadline. A decision table maps registered, not disabled, token valid, and rate-limit-clear causes to issue-token, reject, or throttle effects; disjointness and completeness checks expose an omitted disabled-plus-invalid rule. The use-case model covers request, email delivery, token entry, success, retry, expiry, and lockout paths. The state model has Ready, TokenIssued, Verified, Locked, and Expired states, including invalid events such as verification from Ready. The same requirement IDs flow into partition rows, table rules, scenario steps, state transitions, and an oracle/coverage ledger, allowing a reviewer to see what is tested and what is not.\n\nEvidence is mixed on relative fault-finding power. An avionics study reported BVA as more effective than EP and random testing under its operational profile, while replicated subject studies found EP and branch testing broadly similar and context-sensitive. These are not universal rankings: subject skill, program domain, fault distribution, specification quality, and tes